{
  "contract_version": "artifact-bundle-v1",
  "bundle_id": "artifact-bundle-raw-trace-001",
  "run_binding": {
    "run_id": "run-diagnostic-trace-001",
    "cell_id": "cell-http3-trace-001",
    "repetition": 0,
    "scenario_id": "h3.protocol.multiplex-100-streams",
    "scenario_version": "1.0.0",
    "suite_id": "diagnostic-h3",
    "protocol": "h3",
    "implementation_id": "example-implementation",
    "test_executor_id": "example-test-executor",
    "load_profile_id": "diagnostic",
    "execution_profile": "diagnostic"
  },
  "created_at_utc": "2026-06-14T14:00:00Z",
  "artifacts": [
    {
      "artifact_id": "raw-binary-trace-001",
      "kind": "trace",
      "media_type": "application/octet-stream",
      "path": "artifacts/raw-binary-trace-001.bin",
      "sha256": "0123456789abcdef0123456789abcdef0123456789abcdef0123456789abcdef",
      "size_bytes": 8192,
      "created_at_utc": "2026-06-14T14:00:01Z",
      "producer": {
        "kind": "implementation",
        "id": "example-implementation",
        "version": "1.2.3",
        "description": "Implementation diagnostic trace producer.",
        "telemetry_system": "binary-trace"
      },
      "redaction_state": "internal-only",
      "contains_sensitive_data": true,
      "retention_class": "internal",
      "description": "Raw binary diagnostic trace referenced by content hash. The contract does not define the trace format.",
      "tags": {
        "profile": "diagnostic"
      }
    }
  ],
  "warnings": ["Raw diagnostic artifacts may require implementation-specific review before publication."],
  "errors": [],
  "redaction": {
    "state": "internal-only",
    "reviewed_at_utc": "2026-06-14T14:01:00Z",
    "reviewed_by": "fixture-author",
    "notes": "Manifest retained for diagnostic evidence; raw payload is not public."
  }
}
